<?xml version = "1.0" standalone="no"?>
<!DOCTYPE root SYSTEM "../dtd/complexities.dtd">
<root>
    <conditions>
        <!--
        <condition id="">
            <code></code>
            <value></value>
        </condition>
        -->
        <condition id="1">
            <code>1==1</code>
            <value>True</value>
        </condition>

        <condition id="2">
            <code>1==0</code>
            <value>False</value>
        </condition>

        <condition id="3">
            <code>(4+2&lt;=42)</code>
            <value>True</value>
        </condition>

        <condition id="4">
            <code>(4+2>=42)</code>
            <value>False</value>
        </condition>

        <condition id="5">
            <code>(math.pow(4, 2)&lt;=42)</code>
            <value>True</value>
        </condition>

        <condition id="6">
            <code>(math.pow(4, 2)>=42)</code>
            <value>False</value>
        </condition>

        <condition id="7">
            <code>(math.sqrt(42)&lt;=42)</code>
            <value>True</value>
        </condition>

        <condition id="8">
            <code>(math.sqrt(42)>=42)</code>
            <value>False</value>
       </condition>

        <!-- TODO add other conditions-->
    </conditions>

    <complexities>
        <!--
        <complexity id="" type="" group="" executed="" in_out_var="i" indirection="" need_id="">
            <code></code>
            <body></body>
        </complexity>
        -->
        <!-- Conditional branching -->
        <!-- if statements-->

        <complexity id="1" type="if" group="conditionals" executed="condition">
            <code>
        if {{ condition }}:
	INDENT
                {{ placeholder }}
	ENDINDENT
            </code>
        </complexity>

        <complexity id="2" type="if" group="conditionals" executed="condition">
            <code>
        if {{ condition }}:
	INDENT
                {{ placeholder }}
	ENDINDENT
        else:
	INDENT
                {}
	ENDINDENT
            </code>
        </complexity>

        <complexity id="3" type="if" group="conditionals" executed="not_condition">
            <code>
        if {{ condition }}:
	INDENT
                {}
	ENDINDENT
        else:
        INDENT
                {{ placeholder }}
        ENDINDENT
            </code>
        </complexity>

        <complexity id="4" type="if" group="conditionals" executed="condition">
            <code>
        if {{ condition }}:
	INDENT
                {{ placeholder }}
	ENDINDENT
        elif not {{ condition }}:
	INDENT
                {}
	ENDINDENT
            </code>
        </complexity>

        <complexity id="5" type="if" group="conditionals" executed="not_condition">
            <code>
        if {{ condition }}:
	INDENT
                {}
	ENDINDENT
        elif not {{ condition }}:
	INDENT
                {{ placeholder }}
	ENDINDENT
            </code>
        </complexity>

        <complexity id="6" type="if" group="conditionals" executed="condition">
            <code>
        if {{ condition }}:
	INDENT
                {{ placeholder }}
	ENDINDENT
        elif not {{ condition }}:
	INDENT
                {}
	ENDINDENT
        else:
        INDENT
                {}
        ENDINDENT
            </code>
        </complexity>

        <complexity id="7" type="if" group="conditionals" executed="not_condition">
            <code>
        if {{ condition }}:
	INDENT
                {}
	ENDINDENT
        elif not {{ condition }}:
	INDENT
                {{ placeholder }}
	ENDINDENT
        else:
        INDENT
                {}
        ENDINDENT
            </code>
        </complexity>

        <complexity id="8" type="if" group="conditionals" executed="0">
            <code>
	if {{condition}}:
	INDENT
                {}
	ENDINDENT
        elif not {{condition}}:
	INDENT
                {}
	ENDINDENT
        else:
        INDENT
	    {{placeholder}}
	ENDINDENT
            </code>
        </complexity>

        <!-- Switch cases  -->
        <complexity id="11" type="switch" group="conditionals" executed="0">
            <code>
	match 6:
	INDENT
            case 6:
	    INDENT
                pass
	    ENDINDENT
            case _:
	    INDENT
                {{ placeholder }}
	    ENDINDENT
	ENDINDENT
            </code>
        </complexity>

        <complexity id="12" type="switch" group="conditionals" executed="1">
            <code>
	match 6:
	INDENT
            case 6:
	    INDENT
                {{ placeholder }}
	    ENDINDENT
            case _:
	    INDENT
                pass
	    ENDINDENT
	ENDINDENT
            </code>
        </complexity>

        <!--Conditional and unconditional loops -->

        <complexity id="20" type="while" group="loops" executed="condition">
            <code>
        while {{ condition }}:
	INDENT
                {{ placeholder }}
                break
	ENDINDENT
            </code>
        </complexity>

        <complexity id="21" type="while" group="loops" executed="1" need_condition="1">
            <code>
        while True:
	INDENT
                {{ placeholder }}
                if {{ condition }}:
		INDENT
                        break
		ENDINDENT
                break
	ENDINDENT
            </code>
        </complexity>

        <complexity id="22" type="for" group="loops" executed="1" need_id="1">
            <code>
        i_{{id}} = 1
        for x in range(0, i_{{id}}):
	INDENT
                {{ placeholder }}
	ENDINDENT
            </code>
        </complexity>

        <complexity id="23" type="foreach" group="loops" executed="1" need_id="1" in_out_var="in">
            <code>
        # Declaring an array
        arr_{{ id }} = []

        # Storing value in array element
        arr_{{ id }}.append(None)
        arr_{{ id }}.append(None)
        arr_{{ id }}.append(None)
        arr_{{ id }}.append({{ in_var_name }})

        for val_{{id}} in arr_{{ id }}:
	INDENT
            if val_{{ id }}!=None:
	    INDENT
                {{ out_var_name }} = val_{{ id }}
                {{ placeholder }}
	    ENDINDENT
	ENDINDENT
            </code>
        </complexity>

        <!-- Unconditional jumps -->
	<!-- not supported in Python -->

        <!-- Functions -->
        <complexity id="50" type="function" group="functions" executed="1" in_out_var="traversal" indirection="1" need_id="1">
            <code>{{out_var_name}} = {{call_name}}({{in_var_name}})</code>
            <body>
def {{call_name}}( param_{{id}} ):
INDENT
        {{local_var}}
        {{in_var_name}} = param_{{id}}
        {{ placeholder }}
        return {{out_var_name}}
ENDINDENT

            </body>
        </complexity>

        <complexity id="51" type="function" group="functions" executed="1" in_out_var="in" indirection="1" need_id="1">
            <code>
        {{out_var_name}} = {{call_name}}({{in_var_name}})
        {{ placeholder}}
            </code>
            <body>
def {{call_name}}( param_{{id}} ):
INDENT
        return param_{{id}}
ENDINDENT

            </body>
        </complexity>

        <complexity id="52" type="function" group="functions" executed="1" in_out_var="out" indirection="1" need_id="1">
            <code>
        {{ placeholder}}
        {{out_var_name}} = {{call_name}}({{in_var_name}})
            </code>
            <body>
def {{call_name}}( param_{{id}} ):
INDENT
        return param_{{id}}
ENDINDENT

            </body>
        </complexity>

        <!-- Classes -->
        <complexity id="70" type="class" group="classes" executed="1" in_out_var="traversal" need_id="1" indirection="1">
            <code>
        var_{{id}} = {{call_name}}({{in_var_name}});
        {{out_var_name}} = var_{{id}}.get_var_{{id}}();
            </code>
            <body>
'''
{{comments}}
'''

{{ imports }}

{{static_methods}}

class {{call_name}}:
INDENT
        def __init__(self,{{in_var_name}}_{{id}}):
	INDENT
                self.var_{{id}} = {{in_var_name}}_{{id}}
	ENDINDENT

        def  get_var_{{id}}(self):
	INDENT
                {{local_var}}
                {{in_var_name}} = var_{{id}}
                {{ placeholder}}
                return {{out_var_name}}
	ENDINDENT
ENDINDENT
            </body>
        </complexity>

        <complexity id="71" type="class" group="classes" executed="1" in_out_var="in" need_id="1" indirection="1">
            <code>
        var_{{id}} = {{call_name}}({{in_var_name}})
        {{out_var_name}} = var_{{id}}.get_var_{{id}}()
        {{placeholder}}
            </code>
            <body>
'''
{{comments}}
'''
               
class {{call_name}}:
INDENT
        def __init__(self, param):
	INDENT
                self.var_{{id}} = param
	ENDINDENT

        def get_var_{{id}}(self):
	INDENT
                return self.var_{{id}}
	ENDINDENT

ENDINDENT
            </body>
        </complexity>

        <complexity id="72" type="class" group="classes" executed="1" in_out_var="out" need_id="1" indirection="1">
            <code>
        {{placeholder}}
        var_{{id}} = {{call_name}}({{in_var_name}})
        {{out_var_name}} = var_{{id}}.get_var_{{id}}()
            </code>
            <body>
'''
{{comments}}
'''

class {{call_name}}:
INDENT
        def __init__(self,param):
	INDENT
                self.var_{{id}} = param
	ENDINDENT
    
        def get_var_{{id}}(self):
	INDENT
                return self.var_{{id}}
	ENDINDENT
ENDINDENT
            </body>
        </complexity>
    </complexities>
</root>
