<?xml version = "1.0" standalone="no"?>
<!DOCTYPE root SYSTEM "../dtd/complexities.dtd">
<!-- *modified "Fri Sep 23 12:20:31 2022" *by "Paul E. Black" -->
<root>
    <conditions>
        <condition id="one">
            <code>1==1</code>
            <value>True</value>
        </condition>
    </conditions>

    <complexities>
        <complexity id="eight" type="if" group="conditionals" executed="0">
            <code>
if({{ condition }}):
    {}
elif(not {{ condition }}):
    {}
else:
    {{ placeholder }}
            </code>
        </complexity>

        <!--Conditional and unconditional loops -->

        <complexity id="12" type="while" group="loops" executed="1" need_condition="1">
            <code>
while True:
    {{ placeholder }}
    if({{ condition }}):
        break
            </code>
        </complexity>

    </complexities>
</root>
